{
  "packet_id": "GP-0015",
  "schema_version": "1.0.0",
  "description": "Security pack: detect hardcoded password in config",
  "tags": ["security", "config", "password", "hardcoded-secret"],
  "rule_id": "CONFIG_HARDCODED_PASSWORD",
  "rule_version": "1.0.0",
  "pack_name": "security",
  "input_facts": {
    "files": [
      {
        "path": "database.conf",
        "content": "[database]\nhost = db.internal\nport = 5432\npassword = 'SuperSecretP@ssw0rd!'\nuser = admin\n"
      }
    ]
  },
  "expected": {
    "triggered": true,
    "finding_count_min": 1,
    "has_blocking": false,
    "severity": "HIGH"
  },
  "explanation_trace": {
    "why_triggered": "Content matches the hardcoded password regex: password followed by = and a quoted string of 8+ chars",
    "matched_pattern": "password = 'SuperSecretP@ssw0rd!'",
    "scanner_type": "SecretScanner",
    "edge_case_notes": "The regex requires at least 8 characters in the password value to reduce false positives"
  }
}
