{
  "packet_id": "GP-0003",
  "schema_version": "1.0.0",
  "description": "Base pack: clean file should NOT trigger secret detection",
  "tags": ["base", "security", "negative-test", "false-positive-guard"],
  "rule_id": "SECRET_API_KEY_DETECTED",
  "rule_version": "1.0.0",
  "pack_name": "base",
  "input_facts": {
    "files": [
      {
        "path": "main.py",
        "content": "#!/usr/bin/env python3\n\ndef hello():\n    print('Hello, world!')\n\nif __name__ == '__main__':\n    hello()\n"
      }
    ]
  },
  "expected": {
    "triggered": false,
    "finding_count_min": 0,
    "finding_count_max": 0,
    "has_blocking": false
  },
  "explanation_trace": {
    "why_triggered": "No secrets, tokens, keys, or sensitive patterns in the file content",
    "scanner_type": "SecretScanner",
    "edge_case_notes": "This is a negative test ensuring no false positives on benign Python code"
  }
}
