{
  "packet_id": "GP-0017",
  "schema_version": "1.0.0",
  "description": "Privacy pack: detect SSN-like pattern in log data",
  "tags": ["privacy", "pii", "ssn", "sensitive-data"],
  "rule_id": "PII_SSN_LIKE",
  "rule_version": "1.0.0",
  "pack_name": "privacy",
  "input_facts": {
    "files": [
      {
        "path": "audit.log",
        "content": "2025-01-15 INFO User verification: SSN provided 123-45-6789 for identity check\n"
      }
    ]
  },
  "expected": {
    "triggered": true,
    "finding_count_min": 1,
    "has_blocking": false,
    "severity": "HIGH"
  },
  "explanation_trace": {
    "why_triggered": "Content matches SSN pattern: 3 digits, separator, 2 digits, separator, 4 digits",
    "matched_pattern": "123-45-6789",
    "scanner_type": "PIIScanner",
    "edge_case_notes": "SSN detection uses a heuristic pattern that may also match other 9-digit sequences with separators"
  }
}
