{
  "packet_id": "GP-0021",
  "schema_version": "1.0.0",
  "description": "Security pack: multiple different secrets in same file should produce multiple findings",
  "tags": ["security", "multi-finding", "edge-case", "regression"],
  "rule_id": "SECRET_AWS_ACCESS_KEY",
  "rule_version": "1.0.0",
  "pack_name": "security",
  "input_facts": {
    "files": [
      {
        "path": "leaked_creds.env",
        "content": "AWS_KEY=AKIAIOSFODNN7EXAMPLE\nSLACK=xoxb-1234567890-abcdefghijklm\nGH_TOKEN=ghp_ABCDEFGHIJKLMNOPQRSTUVWXYZabcdefghij1234\n"
      }
    ]
  },
  "expected": {
    "triggered": true,
    "finding_count_min": 1,
    "has_blocking": true,
    "severity": "BLOCKER"
  },
  "explanation_trace": {
    "why_triggered": "File contains AWS access key matching AKIA pattern. Other secrets in the file may also trigger findings from their respective rules.",
    "matched_pattern": "AKIAIOSFODNN7EXAMPLE",
    "scanner_type": "SecretScanner",
    "edge_case_notes": "Tests that the scanner can detect the target rule's pattern even when other secret types are present in the same file"
  }
}
