{
  "packet_id": "GP-0001",
  "schema_version": "1.0.0",
  "description": "Base pack: detect hardcoded API key in Python source",
  "tags": ["base", "security", "secret-detection"],
  "rule_id": "SECRET_API_KEY_DETECTED",
  "rule_version": "1.0.0",
  "pack_name": "base",
  "input_facts": {
    "files": [
      {
        "path": "config.py",
        "content": "api_key = 'sk-1234567890abcdef1234567890abcdef'"
      }
    ]
  },
  "expected": {
    "triggered": true,
    "finding_count_min": 1,
    "has_blocking": false,
    "severity": "HIGH"
  },
  "explanation_trace": {
    "why_triggered": "The file contains an api_key assignment with a string value matching the built-in api_key pattern in SecretScanner",
    "matched_pattern": "api_key = 'sk-...'",
    "scanner_type": "SecretScanner",
    "edge_case_notes": "Rule has no explicit matchers, so SecretScanner uses its built-in SECRET_PATTERNS"
  }
}
